approach,query_no,latency,average_relative_error,bin_completeness,total_bins,query,sample_percentage
ApproachType.MODEL_BASED,0,0.021411758999999808,99.99119101480142,100,1,"select sum(lo_extendedprice*lo_discount) from lineorder, dwdate where lo_orderdate = d_datekey and d_year = 1993 and lo_discount>=1 and lo_discount<=3 and lo_quantity < 25;",100
ApproachType.MODEL_BASED,1,0.022217522000000045,99.99116518944517,100,1,"select sum(lo_extendedprice*lo_discount) from lineorder, dwdate where lo_orderdate = d_datekey and d_yearmonthnum = 199401 and lo_discount>=4 and lo_discount<=6 and  lo_quantity>=26 and lo_quantity<=35;",100
ApproachType.MODEL_BASED,2,0.023306301999999945,99.99109131235113,100,1,"select sum(lo_extendedprice*lo_discount) from lineorder, dwdate where lo_orderdate = d_datekey and d_weeknuminyear = 6 and d_year = 1994 and lo_discount>=5 and lo_discount<=7 and lo_quantity>=26 and lo_quantity<=35;",100
ApproachType.MODEL_BASED,3,0.1039026780000003,99.99097168320151,100.0,280,"select d_year, p_brand1, sum(lo_revenue) from lineorder, dwdate, part, supplier where lo_orderdate = d_datekey and lo_partkey = p_partkey and lo_suppkey = s_suppkey and p_category = 'MFGR#12' and s_region = 'AMERICA' group by d_year, p_brand1 order by d_year, p_brand1;",100
ApproachType.MODEL_BASED,4,0.03831277500000008,99.9912771836091,100.0,56,"select d_year, p_brand1, sum(lo_revenue) from lineorder, dwdate, part, supplier where lo_orderdate = d_datekey and lo_partkey = p_partkey and lo_suppkey = s_suppkey and p_brand1 in ('MFGR#2221','MFGR#2222','MFGR#2223','MFGR#2224','MFGR#2225','MFGR#2226','MFGR#2227','MFGR#2228') and s_region = 'ASIA' group by d_year, p_brand1 order by d_year, p_brand1;",100
ApproachType.MODEL_BASED,5,0.025754896000000027,99.99121602447269,100.0,7,"select d_year, p_brand1, sum(lo_revenue) from lineorder, dwdate, part, supplier where lo_orderdate = d_datekey and lo_partkey = p_partkey and lo_suppkey = s_suppkey and p_brand1 = 'MFGR#2221' and s_region = 'EUROPE' group by d_year, p_brand1 order by d_year, p_brand1;",100
ApproachType.MODEL_BASED,6,0.06685258099999958,99.99102275322758,100.0,150,"select c_nation, s_nation, d_year, sum(lo_revenue) from customer, lineorder, supplier, dwdate where lo_custkey = c_custkey and lo_suppkey = s_suppkey and lo_orderdate = d_datekey and c_region = 'ASIA' and s_region = 'ASIA' and d_year >= 1992 and d_year <= 1997 group by c_nation, s_nation, d_year order by d_year asc;",100
ApproachType.MODEL_BASED,7,0.17507407300000022,99.99134518781676,100.0,600,"select c_city, s_city, d_year, sum(lo_revenue) from customer, lineorder, supplier, dwdate where lo_custkey = c_custkey and lo_suppkey = s_suppkey and lo_orderdate = d_datekey and c_nation = 'UNITED STATES' and s_nation = 'UNITED STATES' and d_year >= 1992 and d_year <= 1997 group by c_city, s_city, d_year order by d_year asc;",100
ApproachType.MODEL_BASED,8,0.029471263999999664,99.99173409653956,100.0,24,"select c_city, s_city, d_year, sum(lo_revenue) from customer, lineorder, supplier, dwdate where lo_custkey = c_custkey and lo_suppkey = s_suppkey and lo_orderdate = d_datekey and c_city IN ('UNITED KI1', 'UNITED KI5') and s_city IN ('UNITED KI1', 'UNITED KI5') and d_year >= 1992 and d_year <= 1997 group by c_city, s_city, d_year order by d_year asc;",100
ApproachType.MODEL_BASED,9,0.0364022089999998,99.9928313996659,100.0,4,"select c_city, s_city, d_year, sum(lo_revenue) from customer, lineorder, supplier, dwdate where lo_custkey = c_custkey and lo_suppkey = s_suppkey and lo_orderdate = d_datekey and c_city IN ('UNITED KI1', 'UNITED KI5') and s_city IN ('UNITED KI1', 'UNITED KI5') and d_yearmonth = 'Dec1997' group by c_city, s_city, d_year order by d_year asc;",100
ApproachType.MODEL_BASED,10,0.05581499099999965,99.99102042615814,100.0,35,"select d_year, c_nation, sum(lo_revenue) - sum(lo_supplycost) from dwdate, customer, supplier, part, lineorder where lo_custkey = c_custkey and lo_suppkey = s_suppkey and lo_partkey = p_partkey and lo_orderdate = d_datekey and c_region = 'AMERICA' and s_region = 'AMERICA' and p_mfgr IN ('MFGR#1', 'MFGR#2') group by d_year, c_nation order by d_year, c_nation;",100
ApproachType.MODEL_BASED,11,0.09291674299999997,99.99118551339622,100.0,100,"select d_year, s_nation, p_category, sum(lo_revenue) - sum(lo_supplycost) from dwdate, customer, supplier, part, lineorder where lo_custkey = c_custkey and lo_suppkey = s_suppkey and lo_partkey = p_partkey and lo_orderdate = d_datekey and c_region = 'AMERICA' and s_region = 'AMERICA' and d_year >= 1997 and d_year <= 1998 and p_mfgr IN ('MFGR#1', 'MFGR#2') group by d_year, s_nation, p_category order by d_year, s_nation, p_category;",100
ApproachType.MODEL_BASED,12,0.4411285939999998,99.99146967889128,100.0,800,"select d_year, s_city, p_brand1, sum(lo_revenue) - sum(lo_supplycost) from dwdate, customer, supplier, part, lineorder where lo_custkey = c_custkey and lo_suppkey = s_suppkey and lo_partkey = p_partkey and lo_orderdate = d_datekey and c_region = 'AMERICA' and s_nation = 'UNITED STATES' and d_year >= 1997 and d_year <= 1998 and p_category = 'MFGR#14' group by d_year, s_city, p_brand1 order by d_year, s_city, p_brand1;",100
